title	category
နိုင်ငံတွင် ပြည်သူလူထုမှ အကြမ်းအားဖြင့် စတာလင် ပေါင် ၃၃၀,၀၀၀,၀၀၀ ( အမေရိကန်ဒေါ်လာ ၆၀၀,၀၀၀,၀၀၀ နီးပါး) 	2
လှူဒါန်းကြသည်။ ထိုအရာသည် အစိုးရမှ လှူဒါန်းသည်ထက် သိသာထင်ရှားစွာ သာလွန်ပြီး နိုင်ငံသားတစ်ယောက်လျှင် 	2
ပျမ်းမျှအားဖြင့် စတာလင် ပေါင် ၅.၅၀ (အမေရိကန်ဒေါ်လာ ၁၀ ) လှူဒါန်းသကဲ့သို့ ဖြစ်သည်။	2
၂၀၀၆ ခုနှစ် ဩဂုတ်လတွင် ဆူနာမီပြီးနောက် သီရိလင်္ကာ အရှေ ့ မြောက်ဘက်တွင် ပြန်လည်တည်ဆောက် ရေး လုပ်ငန်းများကို 	2
လုပ်ကိုင်နေကြသော ဒေသခံ အကူအညီပေးရေးဝန်ထမ်း ဆယ့်ငါးယောက်သည် အပြင်း အထန် တိုက်ပွဲဖြစ်ပွားပြီးနောက် 	2
အသတ်ခံခဲ့ရသည်ဟု နိုင်ငံတွင်းရှိ အကူအညီပေးရေးအေဂျင်စီများ၏ အဓိက ပေါင်းစည်းထားသည့်အဖွဲ့ မှ ဆိုသည်။ 	2
ဒေသခံအကူအညီပေးရေးဝန်ထမ်းများ အသတ်ခံရခြင်းနှင့် ပတ်သက် သည့် အစီရင်ခံစာများ နှင့် ကောလဟလများရှိခဲ့သည်။	2
စီးပွားရေး ရိုက်ခတ်မှု	2
ကမ်းရိုးတန်းဒေသ ငါးဖမ်းလုပ်ငန်းလုပ်ကိုင်သည့် လူမှုအဖွဲ ့အစည်း ကို ရိုက်ခတ်မှုမှာ၊ ဒေသအတွင်းရှိ အဆင်း ရဲဆုံး လူအချို ့၊ 	2
ဝင်ငွေရှာဖွေပေးသူများစွာ ဆုံးရှုံးပြီး လှေများနှင့် ငါးဖမ်းပစ္စည်းအသုံးအဆောင်များပါ ပျက်စီး ဆုံးရှုံးခဲ့သည်။သီရိလင်္ကာတွင် 	2
ငါးဖမ်း ခြင်းတောင်းများ၊ မြံှုးများနှင့် မှိန်းများ အသုံးများသည့် ရိုးရာ ငါးဖမ်း လုပ်ငန်းသည် ဒေသတွင်း ဈေးကွက်များအတွက် 	2
အရေးပါသော ငါးအရင်းအမြစ်ဖြစ်ပြီး ၊ စက်မှုအတတ်ပညာ ဖြင့် ငါးလုပ်ငန်းသည် အဓိကစီးပွားရေးလုပ်ငန်းဖြစ်ပြီ လူဦးရေ 	2
၂၅၀,၀၀၀ ခန့်ကို တိုက်ရိုက် အလုပ်များပေး ထားသည်။ မကြာသေးမီ နှစ်များအတွင်းက ငါးလုပ်ငန်းသည် ပြည်ပပို့ကုန် 	2
အခန်းကဏ္ဍအဖြစ် အင်တိုက်အား တိုက် ပေါ်ထွက်လာပြီး ပမာဏကြီးမားသော နိုင်ငံခြားငွေ ရှာဖွေခြင်းများကို ဖြစ်ပေါ်စေသည်။	2
ငါးဖမ်းရေယာဉ် စု၏ ၆၆ ရာခိုင်နှုန်း နှင့် ကမ်းရိုးတန်းဒေသများရှိ စက်မှုလုပ်ငန်းနှင့် ဆိုင်သော အခြေခံအဆောက်အအုံ များ သည် 	2
တစ်ရှိန်ထိုးတက်လာသော လှိုင်းများကြောင့် ပျက်စီးခဲ့ကြောင်းကို အကြိုခန့်မှန်းတွက်ချက်ခြင်းများမှ ဖော်ပြကြပြီး ၎င်း သည် 	2
ဒေသတွင်းနှင့် နိုင်ငံတော်အဆင့် နှစ်ခုစလုံးတွင် ဆိုးရွားသော စီးပွားရေး အကျိုးသက် ရောက်မှုများ ရှိလိမ့်မည်။ ဆူနာမီသည် 	2
တမီး(လ်) နဒူ ၏ လှေဝင်းများတွင် ဖန်မျှင်ထည်ဖြင့် အားဖြည့်ပြုလုပ်ထားသော ပလတ်စတစ် နှစ်စင်းတွဲ ရွက်လှေများကို 	2
အသုံးပြုရန် တောင်းဆိုခြင်းအား ဖန်တီးခဲ့သည်။	2
သို့သော် ထိခိုက်ခံရသည့် တိုင်းပြည်၏ စီးပွားရေးများကို ပျက်စီးဆုံးရှုံးစေခြင်းသည် အသေးအဖွဲမျှသာ ဖြစ်လိမ့် မည်ဟု အချို ့သော 	2
စီးပွားရေးပညာရှင်များက ယုံကြည်ကြသည် အဘယ့်ကြောင့်ဆိုသော် ခရီးသွားလုပ်ငန်းနှင့် ငါးဖမ်းလုပ်ငန်းများတွင် 	2
ဆုံးရှုံးမှုများသည် GDP (ဂျီဒီပီ) ၏ အလွန်သေးငယ်သော ရာခိုင်နှုန်းသာ ဖြစ်၍ ဖြစ် သည်။ မည်သို့ပင်ဖြစ်စေ 	2
အခြေခံအဆောက်အအုံများ ပျက်စီးခြင်းသည် ပို၍အရေးပါသော အချက်ဖြစ်သည်ဟု အချို ့ကသတိပေးကြသည်။ အချို 	2
့နေရာများတွင် သောက်သုံးရေ ထောက်ပံ့ခြင်းများနှင့် စိုက်ပျိုးမွေးမြူရေး ခြံ များ လယ်ကွင်းများသည် သမုဒ္ဒရာမှ 	2
ဆားငန်ရေများကြောင့် နှစ်ပေါင်းများစွာကြာအောင် ညစ်ညမ်းစေနိုင်သည်။	2
ငလျင် နှင့် ဆူနာမီ နှစ်မျိုးစလုံးသည် ပင်လယ်ကြမ်းပြင်အောက် 	2
အနက်ကိုပြောင်းလဲခြင်းနှင့်ရေကြောင်းပြဗော်ယာများနှင့်သင်္ဘောအအိုအဟောင်းအပျက်များကိုအနှောင့်အယှက်ပေးခြင်း ဖြင့် 	2
မက်လက်ကာ ရေလက် ကြား တွင် သင်္ဘောများ သွားလာခြင်းကို ထိခိုက်စေခဲ့သည်။ ရေကြောင်းပြ မြေပုံအသစ်များကို 	2
ပြုစုခြင်းသည် လများစွာ သို့မဟုတ် နှစ်များစွာ ကြာလိမ့်မည်။ခရီးသွား အခြေခံအဆောက်အအုံအများစုမှာ 	2
ဖျက်ဆီးခြင်းမခံရကြောင်း ညွှန်းဆိုပြခြင်းဖြင့် ဒေသတွင်းရှိ နိုင်ငံ များသည် နိုင်ငံခြားခရီးသွားများအား ပြန်၍ 	2
အလည်အပတ်ပြုကြရန် တောင်းပန်ကြသည်။ မည်သို့ပင် ဖြစ်စေ နိုင်ငံခြား ခရီးသွားများသည် စိတ်ပိုင်းဆိုင်ရာ 	2
အကြောင်းပြချက်များဖြင့် ၎င်းအရာကို ပြုလုပ်ရန် နှောင့်နှေးကြ 	2
သည်။ထိုင်းနိုင်ငံပစိဖိတ်ကမ်းရိုးတမ်းရှိလုံးမထိမခိုက်ဘဲကျန်ရစ်သော အပန်းဖြေစခန်းများေ သော်မှ အစီအစဉ် ဖျက်သိမ်းခြင်းတို့ကို 	2
ပြုခြင်းခံရသည်။	2
သဘာဝပတ်ဝန်းကျင်ဆိုင်ရာ ရိုက်ခတ်မှုများ	2
ဖူးခက် မြောက်ပိုင်းရှိ ခေါင်လက်(ခ်) ကို ဆူနာမီ ရေလွှမ်းမိုးနေပုံ၊	2
ထိုင်း ASTER ( အေအက်စ်တီအီးအာ) ပုံရိပ်များနှင့် SRTM ( အက်စ်အာတီအမ်) မြေမြင့်	2
ပုံစံလူအသက်ပေါင်းများစွာ သေဆုံးခြင်းသာမက၊ အိန္ဒိယသမုဒ္ဒရာ ငလျင်သည် ဒေသကို နှစ်ပေါင်းများစွာ ထိခိုက် ခြင်း 	2
ဖြစ်ပေါ်လာမည့် အလွန်ကြီးမားသော သဘာဝပတ်ဝန်းကျင်ဆိုင်ရာ ရိုက်ခတ်မှုများ ဖြစ်စေခဲ့သည်။ လမုပင် များ၊ 	2
သန္တာကျောက်တန်းများ၊ သစ်တောများ၊ ကမ်းရိုးတန်းဒေသ စိမ့်မြေအရပ်များ၊ သဘာဝပေါက်ပင်များ၊ သဲ တောင်ပူစာများ နှင့် 	2
ကျောက်သား ဖြစ်ပေါ်မှုများ၊ တိရိစ္ဆာန်များ နှင့် အပင် ဇီဝမျိုးကွဲများ နှင့် မြေအောက်ရေ ကဲ့ သို့သော ဂေဟစနစ်များအပေါ်တွင် 	2
ပြင်းထန်စွာ ပျက်စီးစေခဲ့ကြောင်း အစီရင်ခံခဲ့သည်။ ထို့အပြင် အခဲ နှင့် အရည် စွန့်ပစ်ပစ္စည်းများ နှင့် စက်မှုလုပ်ငန်းသုံး 	2
ဓာတုပစ္စည်းများ ပျံ ့နှံ့ခြင်း၊ ရေထုညစ်ညမ်းခြင်း နှင့် ရေဆိုး စုဆောင်းသည့်အရာများနှင့် သန့်စင်စက်ရုံများ ဖျက်ဆီးခံရခြင်းသည် 	2
သဘာဝ ပတ်ဝန်းကျင်ကို ဖော်မပြနိုင် လောက်အောင် များပြားသော နည်းလမ်းများဖြင့် ထပ်မံ၍ ခြ ိမ်းခြောက်သည်။ သဘာဝ 	2
ပတ်ဝန်းကျင်ဆိုင်ရာ ရိုက်ခတ်မှုများကို အကဲဖြတ်ရန်အတွက် ရှည်ကြာသော အချိန်တစ်ခုနှင့် အရေးပါသော အရင်းအမြစ်များ လို 	2
အပ်လိမ့်မည်။	2
အထူးကျွမ်းကျင်သူများ၏ အဆိုအရ အဓိကကျသော သက်ရောက်မှုသည် ရေချို အထောက်အပံ့ပေးခြင်းကို 	2
အဆိပ်အတောက်ဖြစ်စေခြင်း နှင့် မြေကြီးအတွင်းသို့ ဆားငန်ရေ ဝင်ရောက်ခြင်း နှင့် စိုက်ပျိုးနိုင်သောမြေ အ ပေါ်တွင် 	2
ဆားအလွှာတစ်ခု အနည်ကျခြင်းတို့ကြောင့် ဖြစ်ပွားရကြောင်း သိရသည်။ မော်ဒိုက်(ဖ်) တွင် ရှိသော အလယ်တွင် ရေအိုင်ရှိသည့် 	2
သန္တာကျောက်တန်း ၁၆ မှ ၁၇ ခုသည် ပင်လယ်လှိုင်းလုံးများဖြင့် လွှမ်းမိုးခြင်း ခံရ ကာ ရေချိုလုံးဝမရှိတော့ဘဲ 	2
ဆယ်စုနှစ်ပေါင်းများစွာတိုင်အောင် နေထိုင်ရန် သင့်လျော်တော့မည်မဟုတ်ကြောင်း အစီရင်ခံသည်။ လူထုကို အကျိုးပြုနေသော 	2
မရေတွက်နိုင်သော ရေတွင်းများသည် ပင်လယ်ရေ၊ သဲနှင့် မြေကြီး တို့၏ ကျူးကျော်ဝင်ရောက်ခြင်းကို ခံရပြီး 	2
ရေအောင်းလွှာများသည် အပေါက်ငယ်များပါသော ကျောက်များမှ တဆင့် ကျူးကျော်ဝင်ရောက်ခြင်း ခံရသည်။ 	2
ဆားများနေသောမြေကြီးသည် သီးနှံမဖြစ်ထွန်းနိုင်တော့ဘဲ ၎င်း ကို စိုက်ပျိုးရေး အတွက် ပြန်လည်ဖော်ထုတ်ရန် ခက်ခဲပြီး 	2
ငွေကုန်ကြေးကျများလိမ့်မည်။ ၎င်းသည် အပင်များ နှင့် အလွန်သေးငယ်သော မြေကြီးဇီဝသက်ရှိများ သေဆုံးခြင်းကိုလည်း 	2
ဖြစ်ပေါ်စေသည်။	2
သီရိလင်္ကာတွင် ထောင်ပေါင်းများစွာသော ဆန်စပါး၊ သရက်နှင့် ငှက်ပျောသီး စိုက်ပျိုးခြင်းများ အားလုံးနီးပါးမျှ ဖျက်ဆီး ခြင်းခံရ 	2
ပြီး ပြန်လည် နာလန်ထူလာစေရန် နှစ်ပေါင်းများစွာ ကြာလိမ့်မည်။ (UNEP) ကုလသမဂ္ဂ သဘာဝ ပတ်ဝန်း ကျင် အစီအစဉ် 	2
သည် ဂေဟစနစ် ရိုက်ခတ်မှု ပြင်းထန်ခြင်းကို ဆုံးဖြတ်ရန်နှင့် ၎င်းကိုမည်သို့ ရင်ဆိုင်ရန် အတွက် ဒေသအတွင်းရှိ အစိုးရများနှင့် 	2
အတူတကွ ပူးပေါင်း လုပ်ဆောင်ကြသည်။[93] UNEP သည် ဆူနာမီ ဒဏ်ခံရသော တိုင်းပြည်များမှ 	2
နည်းပညာဆိုင်ရာအကူအညီများကို တောင်းခံခြင်းအား တုံ့ပြန်ရန်အတွက် အထူး လုပ်ငန်းအဖွဲ ့တစ်ခုကို ထူထောင်ရန် 	2
အရေးပေါ်ရန်ပုံငွေ အဖြစ် အမေရိကန် ဒေါ်လာ ၁,၀၀၀,၀၀၀ ကို ကြိုတင် လျာထားရန် ဆုံးဖြတ်ခဲ့ကြသည်။[94] မော်ဒိုက်(ဖ်) 	2
အစိုးရ ၏ တောင်းခံခြင်းကို တုံ့ပြန်သည့်အနေဖြင့် ဩစတြေး လျ အစိုးရသည် မော်ဒိုက်(ဖ်) ခရီးသွားလုပ်ငန်း၏ 	2
အသက်သွေးကြော ဖြစ်သော အဏ္ဏဝါ သဘာဝ ပတ်ဝန်း ကျင်နှင့် သန္တာကျောက်တန်းများ ကို ယခင်အခြေအနေအတိုင်း ပြန်ဖြစ်ရန် 	2
ကူညီပေးမည့် ဂေဟစနစ် အထူး ကျွမ်းကျင်သူများကို စေလွှတ်ခဲ့သည်။ ဂေဟစနစ် နှင့်ဆိုင်သော ကျွမ်းကျင်သူအများစုမှာ 	2
ဩစတြေးလျ အရှေ ့ မြောက်ဘက် ရေပြင်ရှိ (Great Barrier Reef) ဂရိတ်ဘာရီယာရိ(ဖ်)ခေါ် ဂရိတ်ဘာရီယာ 	2
သန္တာ ကျောက်တန်း တွင် အလုပ်လုပ်ကိုင်ခဲ့သည်။	2
တရုတ်ပြည် အနောက်တောင်ဘက် စီချွမ်ပြည်နယ်၊ မောက်စီရင်စု၊ တျယ်ရှိမြို့၌ ၂၄ ဇွန် ၂၀၁၇ နံနက် ၅ နာရီ ၃၈ မိနစ်တွင် မြေပြိုမှု 	2
ဖြစ်ပွားသည်။ ရှင်းမောရွာ၌ အိမ်ခြေ အလုံး ၄၀ ပျက်စီးကာ လူ ၁၅ ဦး သေဆုံးပြီး၊ ၂၆ ဇွန်အထိ ၉၃ ဦး ပျောက်ဆုံးနေဆဲ ဖြစ်သည်။ 	2
ဒေသစံတော်ချိန် ည ၈ နာရီ ၁၅ တွင် ဒုတိယအကြိမ် ‌အသေးစား မြေပြိုရာ ကယ်ဆယ်ရေး နှောင့်နှေးရသည်။	2
တောမီးသည် ခြောက်သွေ့သော သစ်တောဒေသ သို့မဟုတ် ကျေးလက်ဒေသ တောပိုင်းတွင် လောင်ကျွမ်းသည့် 	2
မီးဖြစ်သည်။[၁][၂] အခြားမီးဘေးနှင့် ကွဲပြားချက်မှာ တောမီးသည် အတိုင်းအတာ ကြီးမားပြီး အနီးဝန်းကျင်သို့ အလျင်အမြန် 	2
ကူးစက်လောင်ကျွမ်းနိုင်ခြင်းဖြစ်သည်။ ဦးတည်ရာအရပ်ကို ခန့်မှန်းရခက်သလို လမ်းများ၊ မြစ်ချောင်းများကို ခုန်ကျော်ကာ 	2
လောင်ကျွမ်းလေ့ရှိသည်။[၃] တောမီး၏ ထူးခြားချက်ကို မီးလောင်ကျွမ်းရသည့် အကြောင်းအရင်း၊ ကူးစက်သည့် အရှိန်၊ 	2
မီးလောင်ကျွမ်းသည့် ဧရိယာအတွင်းရှိ မီးလောင်ကျွမ်းနိုင်သော အရာဝတ္ထုများ၊ မိုးလေဝသအခြေအနေ စသည့် အချက်များပေါ် 	2
မူတည်၍ သတ်မှတ်သည်။	2
A daytime fire engulfing large trees	2
A wildfire in California on September 5, 2008	2
တောမီး ဖြစ်ပွားသော စိုက်ခင်းများပေါ် မူတည်၍ တောမီးကို ရှပ်ပြေးမီး(brush fire)၊ ချုံပုတ်မီး(bush fire)၊ 	2
ကန္တရမီး (desert fire)၊ တောအုပ်မီး (forest fire)၊ မြက်ရိုင်းမီး (grass fire)၊ 	2
တောင်ကုန်းမီး (hill fire)၊ သစ်ဆွေးမီး (peat fire)၊ စိုက်ခင်းမီး (vegetation fire)နှင့် 	2
မြက်ခင်းပြင်မီး (veld fire)ဟူ၍ အမျိုးအစား ခွဲခြားနိုင်သည်။[၄] လွန်ခဲ့သော နှစ် သန်း ၄၂၀ မှ ကမ္ဘာပေါ်တွင် 	2
အပင်များ ပေါ်ပေါက်လာသည့် အချိန်မှ စ၍ တောမီးဟူ၍ စတင် ဖြစ်ပေါ်လာကြောင်း ကျောက်ဖြစ် ရုပ်ကြွင်း မီးသင့်ကျောက်များက 	2
ညွှန်ပြနေသည်။[၅] ကမ္ဘာပေါ်ရှိ သက်ရှိသမိုင်း တလျှောက်တွင် တောမီး ဖြစ်ပေါ်ခြင်းသည် ဇီဝစနစ်၏ သစ်ပင်ပန်းမန်များနှင့် 	2
တောကောင်များအပေါ် ကြီးမားသော ဆင့်ကဲ ပြောင်းလဲမှု အကျိုး သက်ရောက်မည်ကို ခန့်မှန်းနိုင်သည်။[၆] ကမ္ဘာကြီးသည် 	2
ကာဘွန်ကြွယ်ဝသော အပင်များ၊ ခြောက်သွေ့သော ဥတုများ၊ လေထဲရှိ အောက်ဆီဂျင်များနှင့် ကျယ်ပြန့်သော လျှပ်စီးများနှင့် 	2
မီးတောင် ပေါက်ကွဲမှုများကြောင့် နဂိုကတည်းကပင် လောင်ကျွမ်းလွယ်သော ဂြိုဟ်ကြီး တလုံး ဖြစ်နေသည်။[၆]	2
တောမီးများသည် သဘောသဘာဝကပင် လောင်ကျွမ်းပစ်သော ဂုဏ်သတ္တိ ရှိပြီး၊ လောင်ကျွမ်းနိုင်သော အရာဝတ္ထု ရှိပါက 	2
လောင်ကျွမ်းသည်။[၇] တောမီးများသည် လူ့အသက်နှင့် ပစ္စည်းဥစ္စာများကို ဆုံးရှုံးစေနိုင်သော်လည်း၊ မီး‌တွင်း ပါဝင်သော 	2
သီးပင်စားပင်၊ သတ္တဝါနှင့် ဇီဝစနစ်အပေါ် ကောင်းကျိုးများစွာ ရှိသည်။[၈][၉] အပင်မျိုးစိတ် များစွာသည် မျိုးပွားရန်နှင့် 	2
ကြီးထွားရန်အတွက် မီး၏ အကျိုးသက်ရောက်မှုများကို မှီခိုနေရသည်။[၁၀] သို့သော် တောမီး လောင်လေ့ မရှိသော နေရာတွင် 	2
လောင်ပါက ဇီဝ အကျိုးသက်ရောက်မှု မခံစားရချေ။[၇] တောမီးသည် လောင်စာများ ရှိနေခြင်းနှင့် ရာသီဥတုကလည်း ကူပံ့ခြင်း 	2
ရှိလျှင် လောင်ကျွမ်းမှု ပိုမို ဆိုးရွားတတ်သည်။[၁၁] [၁၂][၁၃]	2
တောမီးကို တားဆီးခြင်း၊ ထောက်လှမ်းခြင်းနှင့် နှိပ်ကွပ်ခြင်း နည်းဗျူဟာတို့သည် နှစ်ပေါင်းများစွာအတွင်း 	2
ပြောင်းလဲလာသော်လည်း မဆုံးနိုင်သော ဇာတ်မျောကြီး ဖြစ်လျက် ရှိသည်။[၁၄] တွေ့ရအများဆုံးနှင့် အကုန်အကျ အသက်သာဆုံး 	2
နည်းလမ်း တခုမှာ ထိန်းချုပ်၍ လောင်ကျွမ်းမှု (controlled burning) ဖြစ်ပြီး၊ တောမီး လောင်ကျွမ်းရမည့် 	2
အရာပမာဏ နည်းနည်းသာ ရရှိအောင် လျှော့ချပေးခြင်း၊ နည်းနည်းသာ လောင်ကျွမ်းခွင့် ပြုခြင်း ဖြစ်သည်။[၁၅][၁၆]	2
