title	category
ပထဝီဝင် ဆိုသည်မှာ ကမ္ဘာမြေ နှင့်တကွသော အစိတ်အပိုင်းများ၊ ဆက်စပ် မှီတင်းသောအရာများ နှင့် သဘာဝ	2
 ပတ်ဝန်းကျင်တို့ကို လေ့လာသော ဘာသာရပ်တခုဖြစ်သည်။	2
ကမ္ဘာမြေ၏ အစိတ်အပိုင်း (ရူပ ပထဝီဝင်) ဆိုရာ၌ တိုက်ကြီးများ၊ ပင်လယ်၊ သမုဒ္ဒရာ၊ မြစ်၊ ချောင်းများ နှင့် တောင်များ	2
 စသည်တို့ကို ဆိုလိုသည်။ ဆက်စပ်မှီတင်းသောအရာများမှာ သက်ရှိများ 	2
ဖြစ်သော လူ တိရိစ္ဆာန်များ သစ်ပင် စသည်များကို ဆိုလိုပြီး၊ သဘာဝပတ်ဝန်းကျင် 	2
ဆိုရာတွင် မိုးလေဝသ၊ လေမုန်တိုင်းများ၊ ဒီရေ၊ ငလျင် အစရှိသော သဘာဝဘေးအန္တရာယ် အကြောင်းအရာများ ပါဝင်သည်။	2
ပထဝီဝင်ဘာသာရပ် ပညာရှင် တဦးသည် ပတ်ဝန်းကျင်ရှိ အရာများ၊ အကြောင်းအရာများ နှင့် ပတ်သက်၍ မည်သို့ 	2
စတင်ဖြစ်ပေါ်သည်၊ မည်သို့ ဆက်လက် ပြောင်းလဲ ဖြစ်ပေါ်သည် တို့ကို အမြဲမပြတ် လေ့လာသုံးသပ်သည်။	2
ပထဝီဝင်ဘာသာရပ်သည် သဘာဝသိပ္ပံ ဘာသာရပ် (Ecology)၊ နှင့် လေ့လာမှုနယ်ပယ် 	2
တူညီမှုများ ရှိသော်လည်း မတူ ကွဲပြားခြားနားသည်။	2
သဘာဝသိပ္ပံပညာရှင်များက အနာဂါတ် ဖြစ်ရပ်များအပေါ် ခန့်မှန်း တွက်ချက်မှုများ ပြုနေစဉ်တွင် 	2
ပထဝီဝင်ပညာရှင်များက မည်သို့ စတင်ကာ မည်သို့ ပြောင်းလဲဖြစ်ပေါ်လာကြောင်းကို ဖြေရှင်းနိုင်ရန်	2
 စူးစမ်းရှာဖွေကြသည်။ သဘာဝ သိပ္ပံပညာရှင်များသည်လည်း ၎င်းတို့၏ ခန့်မှန်း တွက်ချက်မှုများအတွက် ပထဝီဝင် 	2
ပညာရှင်များကဲ့သို့ လေ့လာကြရသည်။ ပထဝီဝင် (Geography) သည် ဂရိဘာသာစကား 	2
ဆင်းသက်လာသော စကားဖြစ်သည်။ မြန်မာမှု ပြုထားသော ပထဝီဝင်ဆိုသည်မှာ (ပထဝီ(ပါဠိ) = မြေ 	2
သို့မဟုတ် ကမ္ဘာ) + (ဝင်= ဝံသ(ပါဠိ)=အကြောင်းအရာ) ဟူသော စကားမှ ဆင်းသက်သည်။	2
ပထဝီဝင်ဟူသည်မှာ ကမ္ဘာ့မြေမျက်နှာပြင်အကြောင်းကို အထူးဂရုပြု၍ လေ့လာသော သိပ္ပံပညာဖြစ်သည်။ ကမ္ဘာ 	2
မျက်နှာပြင်အကြောင်းကို လေ့လာရာ၌ ပထဝီပညာရှင်သည် ကမ္ဘာပေါ်ရှိ အရပ်ဒေသ တစ်ခုနှင့်တစ်ခု 	2
ကွဲပြားခြားနားပုံများကို စူးစမ်းရှာဖွေ၍၊ အကျိုးအကြောင်းနှင့် ရှင်းလင်းဖော်ပြသည်။ ဤကမ္ဘာ့ မျက်နှာပြင်ကို 	2
ကြည့်ရှုရာ၌ မြေပြင်တစ်ခုတည်းကို သာမက၊ ယင်းအပေါ်တွင် တည်ရှိနေသော ပါးလွှာသော လေထုနှင့် 	2
ယင်းအောက်တွင် တည်ရှိနေသော ရေထုတို့ကိုပါ ထည့်သွင်း၍ ကြည့်ရှုသည်။ ယင်းသည့် လေထု၊ မြေထု၊ ရေထုတို့ 	2
တွေ့ဆုံရာ ရပ်ဝန်းအတွင်း၌သာ သက်ရှိသက်မဲ့တို့ “ ကျွန်းကိုင်းမှီ ကိုင်းကျွန်းမှီ ” ဆိုသကဲ့သို့၊ တစ်ခုနှစ်တစ်ခု အမှီပြု 	2
လျက် ဆက်သွယ်ကာ တည်ရှိနေကြသည်။ ဤကဲ့သို့ ပုံစံ အမျိုးမျိုးဖြင့် ပေါင်းစပ် တည်ရှိနေကြခြင်းကြောင့်လည်း 	2
ကမ္ဘာမျက်နှာပြင်တွင် မြေပြင်လက္ခဏာ အမျိုးမျိုး ဖြစ်ပေါ်လာကြခြင်း ဖြစ်သည်။ ခေတ်သစ်ပထဝီဝင်၏ အဓိက 	2
ရည်ရွယ် ချက်မှာ ကမ္ဘာ့မျက်နှာပြင် တစ်စိတ်တစ်ဒေသတော် သို့မဟုတ် တစ်ခုလုံးတွင်သော်လည်းကောင်း 	2
ဖြစ်ပေါ်တည်ရှိနေသော အကြောင်း ချင်းရာ အမျိုးမျိုးတို့ကို စုပေါင်း လေ့လာရန်ဖြစ်သည်။ ထိုကြောင့် ပထဝီဝင်သည် 	2
ကမ္ဘာပေါ်ရှိ အရပ်ဒေအသီးသီးတွင် မည်ကဲ့သို့ အသွင်အပြင်ရှိသည်၊ အရပ်ဒေသ တစ်ခုနှင့်တစ်ခု 	2
မည်ကဲ့သို့ခြားနားသည်။ သို့မဟုတ် ဆင်တူသည်၊ အဘယ် ကြောင့် ဤကဲ့သို့ ဖြစ်ကြရသည် အစရှိသည်တို့ကို လေ့လာ 	2
ပေသည်။ ကမ္ဘာပေါ် သက်ရှိသက်မဲ့တို့၏ တစ်ခုနှစ်တစ်ခု ဆက်သွယ်လျက် တည်ရှိနေကြ၏။ ပုံစံပြရသော် ငါးသည် 	2
သက်ရှိသတ္တဝါ ဖြစ်သော်လည်း၊ အသက်မရှိသော ရေ၌သာ တည်နေနိုင်သည်။ ထို့အတူ အသက် ရှိသော သစ်ပင်သည် 	2
အသက်မရှိသော မြေဆီလွှာ၌သာ ကြီးပွားရှင်သန်နိုင်သည်။ ငါးကို ရေမှ ထုတ်ယူ လိုက်လျှင်သော်လည်းကောင်း၊ 	2
သစ်ပင်ကို မြေမှ ထုတ်ယူလိုက်လျှင်သော်လည်းကောင်း မကြာမီ သေကျေပျက်စီးသွားလိမ့် မည်။ ဤအကြောင်းကို 	2
ထောက်ရှုခြင်းဖြင့် သက်မဲ့တို့သည် သက်ရှိတို့အတွက် များစွာအရေးကြီးကြောင်းကို သိရှိရသည်။ သဘာဝပထဝီသည် 	2
လူနှင့်သက်ရှိသတ္တဝါတို့၏ နေထိုင် စားသောက်ရေးကို များစွာပြုပြင် ဖန်တီးပေးနိုင်သည်။ 	2
လူနှင့်သက်ရှိသတ္တဝါတို့ကလည်း မိမိတို့ကိုယ်ကို သဘာဝ ပတ်ဝန်းကျင်အခြေအနေများနှင့် ကိုက်ညီအောင် ပြုပြင်၍ 	2
နေထိုင်လုပ်ကိုင်စားသောက်လာကြသည်။ ထိုကြောင့် ပထဝီဝင်ကို လေ့လာရာ၌ သဘာဝပထဝီနှင့် သက်ရှိတို့၏ 	2
အကြောင်းကိုသာမက၊ ယင်းတို့ တစ်ခုနှင့်တစ်ခု အပြန်အလှန် ဆက်စပ် နေပုံကိုလည်း လေ့လာရသည်။ သက်ရှိတို့သည် 	2
သဘာဝပတ်ဝန်းကျင်အခြေအနေ၏ ပြုပြင်ဖန်တီးမှုကြောင့် ပြောင်းလဲလာကြရသည်။ ထိုနည်းအတူ 	2
သဘာဝပတ်ဝန်းကျင် အခြေအနေတို့သည်လည်း လူ၊ တိရစ္ဆာန်၊ သစ်ပင်တို့၏ ပြုပြင်မှုကြောင့် ပြောင်းလဲလာကြသည်။	2
ရှေးအခါက သက်ရှိတို့သည် သဘာဝပထဝီ၏ ပြုပြင်မှု အတိုင်း လိုက်နာခဲ့ကြရသည်။ ပုံစံအားဖြင့် ရေခဲခေတ်အတွင်း၌ 	2
ဝင်ရိုးစွန်းအရပ်မှ ဆင်းသက်လာသော ရေခဲပြင်ကြီးများ၏ ဒဏ်ကြောင့် နေရာ အများအပြား၌ သက်ရှိပေါင်းများစွာ 	2
ကွယ်ပျောက်ကုန်ကြသည်သာမက၊ လူနှင့် တိရစ္ဆာန်များစွာ တို့သည် ပူနွေးသော အီကွေတာဘက်ရှိ အရပ်တို့သို့ 	2
စုရုံးခိုလှုံခဲ့ကြရလသည်။ ထိုပြင် ရာသီဥတုပြောင်းလဲမှုကြောင့် လည်း သက်ရှိများ သေကျေပျက်စီးကြရလေသည်။ 	2
ပုံစံအားဖြင့် ရာသီဥတု ခြောက်သွေ့လာခြင်းကြောင့် မြောက်အမေရိကတိုက်ရှိ သက်ရှိများ 	2
အများအပြားပျက်စီးခဲ့ကြရသည်။ နိုင်းမြစ်ဝှမ်းနှင့် အိုးအေးစစ် အရပ်ကဲ့သို့ ရေကို အလွယ်တကူ ရနိုင်သော နေရာများသို့ 	2
ပြောင်းရွှေ့နေနိုင်သော လူနှင့် တိရစ္ဆာန်များ လောက်သာ အသက်ဘေးမှ လွတ်မြောက်ခဲ့ကြသည်။ 	2
မပြောင်းရွှေ့နိုင်သော သစ်ပင်များနှင့် လျင်မြန်စွာ မပြေးလွှား နိုင်သော သတ္တဝါများသည် ကမ္ဘာ့အခြေအနေလျင်မြန်စွာ 	2
ပြောင်းလဲတိုင်း ပျက်စီးကြရသည်။ အသိပညာ တိုးပွား၍ ယဉ်ကျေးလာသောအခါများ၌ပင်လျှင် လူတို့သည် သဘာဝ၏ 	2
ပြုပြင်စီမံမှုကို များစွာခံနေကြရသေး သည်။ သဘာဝအကြောင်းကို အနည်းငယ်သိနားလည်၍ 	2
ထိန်းကြပ်လာနိုင်သောအခါ ကျမှသာလျှင် လူသည် မိမိတို့ ကိုယ်ကို ပတ်ဝန်းကျင်အခြေအနေများနှင့် ဆီလျော်အောင် ပြုပြင်၍ 	2
နေထိုင်လာတတ်ကြသည်။ အီဂျစ်လူမျိုးတို့သည် ခြောက်သွေ့သော လယ်ယာများတွင် စိုက်ပျိုးလုပ်ကိုင်နိုင်ရန် အတွက် 	2
နိုင်းမြစ်မှရေကို ရေမြောင်းများဖြင့် သွယ်ယူ၍ အသုံးပြုခဲ့ကြသည်။ ဤသို့လျှင် လူတို့သည် မိမိတို့ကိုယ်ကို သဘာဝပတ်ဝန်းကျင်နှင့် 	2
ဆီလျော်အောင် ပြုပြင်၍ နေထိုင် ကြရသောကြောင့် ကျွန်ုပ်တို့သည် သဘာဝပထဝီအကြောင်းကို မသိရှိပါက၊ လူတို့၏ နေထိုင် 	2
လုပ်ကိုင်စားသောက်ကြပုံ၊ တစ်နေရာမှ တစ်နေရာသို့ ပြောင်းရွှေ့ကြပုံ၊ တစ်ဦးနှင့် တစ်ဦး စစ်ဖြစ်ကြပုံ၊ မိတ်ဖွဲ့ကြပုံမှအစ ယင်းတို့၏ 	2
ယဉ်ကျေးမှုနှင့် လက်မှုစက်မှု လုပ်ငန်းများ တိုးတက်ဖြစ်ထွန်းလာကြပုံများကို သိနားလည်ရန် ခဲယဉ်းပေလိမ့်မည်။ ကျွန်ုပ်တို့သည် 	2
ပထဝီကိုသိပါက တစ်ခုသောဒေသ၌ တစ်ခုသော ကာလအပိုင်းအခြားအတွင်း လူတို့ မည်ကဲ့သို့ နေထိုင် 	2
လုပ်ကိုင်စားသောက်ကြသည်။ စီမံအုပ်ချုပ်ကြသည်။ စသည်တို့ကို ခန့်မှန်းကြည့်နိုင်ကြ ပေသည်။ ပုံစံအားဖြင့် နိုင်းမြစ်ဝှမ်းကဲ့သို့ 	2
ကျယ်ပြန့်သော လွင့်ပြင်၍ သူပုန်များ ခိုအောင်းရန် နေရာမရှိ ခြင်းကြောင့် လျင်မြန်စွာ ရွှေ့ပြောင်း သွားလာနိုင်သော 	2
စစ်တပ်အနည်းငယ်ဖြင့်ပင် အလွယ်တကူ ထိန်းသိမ်း စောင့်ရှောက်နိုင်မည်ဖြစ်ရာ ထိုဒေသမျိုးတွင် အာဏာရှင်စနစ်ဖြင့် 	2
အုပ်ချုပ်သော အစိုးရမျိုး ပေါ်ပေါက် ထွန်းကားနိုင်ကြောင်း ခန့်မှန်းကြည့်နိုင်ပေသည်။ ထိုနည်းတူ စွာပင် တောတောင်ထူထပ်သော 	2
ဂရိနိုင်ငံ၊ စကော့တလန်ပြည်၊ အာဖဂနိစတန်နိုင်ငံ စသည်တို့၌ နေထိုင်ကြသည့် ရှေးကျသော တောင်ပေါ်သားများအဖို့ လွတ်လပ်စွာ 	2
နေထိုင်လိုသော စိတ်ဓာတ်များ တဖွားဖွား ပေါ်ပေါက်ပွားများလာရန် အခွင့်ကောင်း ရရှိခဲ့ကြ မည်ကိုလည်း ခန့်မှန်းကြည့်နိုင်ပေ 	2
သည်။ ဤအကြောင်းများကို ထောက်ပြီးလျှင် ပထဝီဝင်သည် လူတို့၏စိတ်ဓာတ်ကို ပြုပြင်ပေးသည်ဟုကား တထစ်ကျ 	2
မယူဆထိုက်ပေ။ အကြောင်းမူကား၊ မည်သည့်နေရာ၌မဆို အာဏာရှင်စံနစ်ကို မုန်းတီးသော စိတ်ဓာတ်များ ပေါ်ပေါက် 	2
လာနိုင်သောကြောင့် ဖြစ်ပေသည်။ သို့ရာတွင် ရှေးနှစ်ပေါင်း များစွာကမူ တောင်တန်းများသည် တောင်ပေါ်သားတို့အား 	2
လွတ်လပ်စွာနှင့် ဖျတ်လတ်စွာ နေထိုင်နိုင်အောင် ဖန်တီးပေးခဲ့ ကြလေသည်။ ယခုအခါမူကား သဘာဝပတ်ဝန်းကျင် 	2
အခြေအနေတို့သည် လူတို့၏ နေထိုင်လုပ်ကိုင်မှုကို ရှေးအခါ ကလောက် ပြုပြင် မပေးနိုင်ကြတော့ချေ။ အစဉ်အလာအားဖြင့် သဘာဝ 	2
အခြေအနေတို့သည် ဆိပ်ကမ်း တည်နေရာများကို သတ်မှတ် ပေးလေသည်။ သို့ရာတွင် ယခုခေတ်၌ လူတို့သည် လေယာဉ် 	2
ဆိပ်များကို မိမိတို့ အလိုရှိသောနေရာများ၌ ဆောက်လုပ်နိုင်ခဲ့ ကြပြီ။ ခြောက်သွေ့သော သဲကန္တာရအရပ်များ၌ပင်လျှင် ရေသွင်းယူ၍ 	2
စိုက်ပျိုးလုပ်ကိုင်နိုင်ခဲ့ကြပြီ။ ရာသီဥတု ကောင်းမွန်သောဒေသများ၌ အကယ်၍ မြေဆီလွှာ မကောင်း ပါက ကောင်းအောင် 	2
ပြုပြင်ပေးတတ်ကြပြီ။ သဘာဝပတ်ဝန်း ကျင်နှင့် လူတို့၏ နေထိုင်လုပ်ကိုင် စားသောက်မှုတို့သည် ယခင်ကကဲ့သို့ပင် 	2
တစ်ခုနှင့်တစ်ခုဆက်လက်၍ ဆက်စပ်တည်ရှိ နေကြသော်ငြားလည်း၊ တစ်ကြိမ်တစ်ခါက သဘာဝတရား၏ ပြုပြင်မှုကို 	2
တသွေမတိမ်းလိုက်နာခဲ့ကြရသော လူတို့သည် အသိပညာတိုးပွားလာသည်နှင့်အမျှ၊ သဘာဝပတ်ဝန်းကျင်ကို တဖြည်းဖြည်း 	2
စိုးမိုးပြုပြင်၍ နေထိုင်လာနိုင်ခဲ့ကြလေသည်။ ဤကဲ့သို့ လူတို့က သဘာဝပတ်ဝန်းကျင်ကို များစွာ ပြုပြင် 	2
ပြောင်းလဲလာနိုင်ခဲ့ခြင်းကြောင့်လည်း၊ ပထဝီဝင်သည် လူတို့အဖို့ ယခင်ကလောက် အရေးမကြီးတော့ဟုထင်မြင်လာကြ လေသည်။ 	2
သဘာဝတရားကို ပြုပြင်နိုင်သော လူတို့၏ စွမ်းရည်ကို ချီးကျူးထိုက်သည်မှန်ပါ၏။ သို့ရာတွင် ငလျင်လှုပ် ခြင်း၊ မီးတောင် 	2
ပေါက်ကွဲခြင်း စသည်တို့သည် နှစ်ပေါင်း များစွာက တည်ဆောက်လာခဲ့သော အိုးအိမ်တိုက်တာများ၊ 	2
လုပ်ငန်းဆောင်တာများနှင့်တကွ လူ့အသက်ပေါင်း အများ အပြားကိုပင်လျှင် တစ်ခဏချင်း ပျက်စီးစေနိုင်ပေသည်။ ထိုပြင် 	2
ခြောက်သွေ့သော ကန္တာရအရပ်၊ အလွန်ဧမြသော တန်ဒြာအရပ်၊ ပူအိုက်စိုစွတ်သော အီကွေတာ သစ်တော အရပ်တို့တွင် လူတို့ သည် 	2
သဘာဝအခြေအနေကို ပြုပြင်၍ နေထိုင်နိုင်ကြသည်ဟု ဆိုသော်လည်း၊ လေမရှိသော လဗိမာန်တွင်မူကား ကြာရှည်စွာ နေနိုင်မည် 	2
မဟုတ်ချေ။ ထိုကြောင့် ပတ်ဝန်းကျင် အခြေအနေ များကို လူတို့သည် မည်မျှလောက်ပင် ပြုပြင်ပြောင်းလဲနိုင်ကြ သည်ဆိုစေကာမူ၊ 	2
ပထဝီဝင်သည် လူ့လုပ်ငန်းဆောင်တာများကို အစဉ် ထာဝရ သတ်မှတ်ပေးနေပေလိမ့်ဦးမည် ဖြစ်ပေသည်။	2
ပထဝီဝင် ဗဟုသုတ တိုးပွားလာပုံ လူတို့ အရပ်တစ်ပါးသို့ စတင်ခရီးထွက်သည့်အချိန်မှ စ၍၊ ပထဝီဝင် ဗဟုသုတ 	2
တိုးပွားလာခဲ့သည်။ ကမ်းခြေအနီးတွင် နေထိုင်သော လူရိုင်းတို့သည် တောင်ပေါ်အရပ်သို့ သွားရောက် ၍၊ တောင်ပေါ်မုဆိုးများ ထံမှ 	2
သားရေများကို ယင်းတို့ ယူဆောင်သွားသော ဆားများဖြင့် လဲလှယ်ခဲ့ကြသည်။ ဤကဲ့သို့ သွားရောက် လည်ပတ်ခြင်းဖြင့်၊ မိမိတို့နှင့် 	2
နေပုံ ထိုင်ပုံ စရိုက် သဘာဝချင်း မတူသော သူများ၏အကြောင်းကို သိရှိလာကြသည်။ ဤနည်းဖြင့် လူတို့၏ ပထဝီဝင် ဗဟုသုတ 	2
တဖြည်းဖြည်း တိုးပွားလာခဲ့လေသည်။ ဂရိလူမျိုးတို့သည် ပထဝီဝင်ကို ပထမဆုံး စတင်လေ့လာ သူများ ဖြစ်ကြသည်။ 	2
မိမိတို့နေထိုင်သော တိုင်းပြည်အနီးရှိ ပင်လယ်ကမ်းရိုးတန်းများကို သိရှိ၍၊ မြေပုံများဖြင့် မှတ်သားခဲ့ ကြသည်။ မြေထဲပင်လယ်ကို 	2
ရွက်လှေကြီးများဖြင့် ဖြတ်သန်း၍၊ အာဖရိကတိုက် အတွင်းသို့ ကုန်းကြောင်းခရီးဖြင့် ဝင်ရောက်ခဲ့ ကြသည်။ ဂရိ ပထဝီပညာရှင် 	2
အာရတိုးစသနီးဆိုသူက ကမ္ဘာ သည် အဝန်းမိုင် ၂၅ဝဝဝဝ ရှိသည်ဟု ဘီစီ ၂၀ဝ လောက်က ပင် တွက်ချက်တင်ပြခဲ့သည်။ 	2
ထိုဂရိလူမျိုးတို့သည် အယ်လက် ဇန္ဒာဘုရင်ကြီးလက်ထက်၌ အိန္ဒိယမြောက်ပိုင်း အိန္ဒုလွင်ပြင် သို့ပင် ရောက်ရှိခဲ့ကြလေသည်။ 	2
အီဂျစ်လူမျိုးနှင့် ဖီနီရှန် လူမျိုး တို့သည် ဂရိလူမျိုးတို့ထက်အလျင် ကုန်းလမ်း၊ ရေလမ်းခရီးဖြင့် နယ်ချဲ့ခဲ့ကြသည် မှန်၏။ သို့ရာတွင် 	2
